{
  "previewInstruction": "<p><b>Tap the double!</b> Bigger numbers this time — pick the right double fast. Three dark hearts, fifteen rounds.</p><p>Harder band: numbers up to forty, lots of cross-decade doubles. Aim under <b>2 seconds</b> per double for <b>3 stars</b>.</p>",
  "previewAudioText": "See a number, then tap its double. Numbers go up to forty, and many cross a ten. Try to answer in under two seconds for three stars. You have three lives.",
  "previewAudio": null,
  "showGameOnPreview": false,
  "totalRounds": 15,
  "totalLives": 3,
  "answerComponent": true,
  "rounds": [
    {
      "set": "A",
      "id": "A_r1_double-18",
      "round": 1,
      "stage": 1,
      "type": "A",
      "n": 18,
      "prompt": "Double of 18",
      "options": [
        36,
        28,
        35
      ],
      "correctIndex": 0,
      "correctValue": 36,
      "correctTTS": "Nice — double of 18 is 36.",
      "correctSubtitle": "Double of 18 is 36.",
      "wrongTTS": "Double of 18 is 36.",
      "wrongSubtitle": "Double of 18 is 36.",
      "misconception_tags": {
        "28": "added-10-instead-of-doubled",
        "35": "off-by-one"
      },
      "answer": {
        "prompt": "Double of 18",
        "options": [
          36,
          28,
          35
        ],
        "correctIndex": 0,
        "correctValue": 36,
        "explanation": "Double of 18 is 36"
      }
    },
    {
      "set": "A",
      "id": "A_r2_double-19",
      "round": 2,
      "stage": 1,
      "type": "A",
      "n": 19,
      "prompt": "Double of 19",
      "options": [
        38,
        39,
        29
      ],
      "correctIndex": 0,
      "correctValue": 38,
      "correctTTS": "Nice — double of 19 is 38.",
      "correctSubtitle": "Double of 19 is 38.",
      "wrongTTS": "Double of 19 is 38.",
      "wrongSubtitle": "Double of 19 is 38.",
      "misconception_tags": {
        "29": "added-10-instead-of-doubled",
        "39": "off-by-one"
      },
      "answer": {
        "prompt": "Double of 19",
        "options": [
          38,
          39,
          29
        ],
        "correctIndex": 0,
        "correctValue": 38,
        "explanation": "Double of 19 is 38"
      }
    },
    {
      "set": "A",
      "id": "A_r3_double-20",
      "round": 3,
      "stage": 1,
      "type": "A",
      "n": 20,
      "prompt": "Double of 20",
      "options": [
        40,
        30,
        39
      ],
      "correctIndex": 0,
      "correctValue": 40,
      "correctTTS": "Nice — double of 20 is 40.",
      "correctSubtitle": "Double of 20 is 40.",
      "wrongTTS": "Double of 20 is 40.",
      "wrongSubtitle": "Double of 20 is 40.",
      "misconception_tags": {
        "30": "added-10-instead-of-doubled",
        "39": "off-by-one"
      },
      "answer": {
        "prompt": "Double of 20",
        "options": [
          40,
          30,
          39
        ],
        "correctIndex": 0,
        "correctValue": 40,
        "explanation": "Double of 20 is 40"
      }
    },
    {
      "set": "A",
      "id": "A_r4_double-21",
      "round": 4,
      "stage": 1,
      "type": "A",
      "n": 21,
      "prompt": "Double of 21",
      "options": [
        42,
        41,
        31
      ],
      "correctIndex": 0,
      "correctValue": 42,
      "correctTTS": "Nice — double of 21 is 42.",
      "correctSubtitle": "Double of 21 is 42.",
      "wrongTTS": "Double of 21 is 42.",
      "wrongSubtitle": "Double of 21 is 42.",
      "misconception_tags": {
        "31": "added-10-instead-of-doubled",
        "41": "off-by-one"
      },
      "answer": {
        "prompt": "Double of 21",
        "options": [
          42,
          41,
          31
        ],
        "correctIndex": 0,
        "correctValue": 42,
        "explanation": "Double of 21 is 42"
      }
    },
    {
      "set": "A",
      "id": "A_r5_double-22",
      "round": 5,
      "stage": 1,
      "type": "A",
      "n": 22,
      "prompt": "Double of 22",
      "options": [
        44,
        32,
        45
      ],
      "correctIndex": 0,
      "correctValue": 44,
      "correctTTS": "Nice — double of 22 is 44.",
      "correctSubtitle": "Double of 22 is 44.",
      "wrongTTS": "Double of 22 is 44.",
      "wrongSubtitle": "Double of 22 is 44.",
      "misconception_tags": {
        "32": "added-10-instead-of-doubled",
        "45": "off-by-one"
      },
      "answer": {
        "prompt": "Double of 22",
        "options": [
          44,
          32,
          45
        ],
        "correctIndex": 0,
        "correctValue": 44,
        "explanation": "Double of 22 is 44"
      }
    },
    {
      "set": "A",
      "id": "A_r6_double-23",
      "round": 6,
      "stage": 2,
      "type": "A",
      "n": 23,
      "prompt": "Double of 23",
      "options": [
        46,
        33,
        45
      ],
      "correctIndex": 0,
      "correctValue": 46,
      "correctTTS": "Nice — double of 23 is 46.",
      "correctSubtitle": "Double of 23 is 46.",
      "wrongTTS": "Double of 23 is 46.",
      "wrongSubtitle": "Double of 23 is 46.",
      "misconception_tags": {
        "33": "added-10-instead-of-doubled",
        "45": "off-by-one"
      },
      "answer": {
        "prompt": "Double of 23",
        "options": [
          46,
          33,
          45
        ],
        "correctIndex": 0,
        "correctValue": 46,
        "explanation": "Double of 23 is 46"
      }
    },
    {
      "set": "A",
      "id": "A_r7_double-24",
      "round": 7,
      "stage": 2,
      "type": "A",
      "n": 24,
      "prompt": "Double of 24",
      "options": [
        48,
        49,
        34
      ],
      "correctIndex": 0,
      "correctValue": 48,
      "correctTTS": "Nice — double of 24 is 48.",
      "correctSubtitle": "Double of 24 is 48.",
      "wrongTTS": "Double of 24 is 48.",
      "wrongSubtitle": "Double of 24 is 48.",
      "misconception_tags": {
        "34": "added-10-instead-of-doubled",
        "49": "off-by-one"
      },
      "answer": {
        "prompt": "Double of 24",
        "options": [
          48,
          49,
          34
        ],
        "correctIndex": 0,
        "correctValue": 48,
        "explanation": "Double of 24 is 48"
      }
    },
    {
      "set": "A",
      "id": "A_r8_double-25",
      "round": 8,
      "stage": 2,
      "type": "A",
      "n": 25,
      "prompt": "Double of 25",
      "options": [
        50,
        35,
        52
      ],
      "correctIndex": 0,
      "correctValue": 50,
      "correctTTS": "Nice — double of 25 is 50.",
      "correctSubtitle": "Double of 25 is 50.",
      "wrongTTS": "Double of 25 is 50.",
      "wrongSubtitle": "Double of 25 is 50.",
      "misconception_tags": {
        "35": "added-10-instead-of-doubled",
        "52": "off-by-two"
      },
      "answer": {
        "prompt": "Double of 25",
        "options": [
          50,
          35,
          52
        ],
        "correctIndex": 0,
        "correctValue": 50,
        "explanation": "Double of 25 is 50"
      }
    },
    {
      "set": "A",
      "id": "A_r9_double-27",
      "round": 9,
      "stage": 2,
      "type": "A",
      "n": 27,
      "prompt": "Double of 27",
      "options": [
        54,
        53,
        37
      ],
      "correctIndex": 0,
      "correctValue": 54,
      "correctTTS": "Nice — double of 27 is 54.",
      "correctSubtitle": "Double of 27 is 54.",
      "wrongTTS": "Double of 27 is 54.",
      "wrongSubtitle": "Double of 27 is 54.",
      "misconception_tags": {
        "37": "added-10-instead-of-doubled",
        "53": "off-by-one"
      },
      "answer": {
        "prompt": "Double of 27",
        "options": [
          54,
          53,
          37
        ],
        "correctIndex": 0,
        "correctValue": 54,
        "explanation": "Double of 27 is 54"
      }
    },
    {
      "set": "A",
      "id": "A_r10_double-28",
      "round": 10,
      "stage": 2,
      "type": "A",
      "n": 28,
      "prompt": "Double of 28",
      "options": [
        56,
        38,
        57
      ],
      "correctIndex": 0,
      "correctValue": 56,
      "correctTTS": "Nice — double of 28 is 56.",
      "correctSubtitle": "Double of 28 is 56.",
      "wrongTTS": "Double of 28 is 56.",
      "wrongSubtitle": "Double of 28 is 56.",
      "misconception_tags": {
        "38": "added-10-instead-of-doubled",
        "57": "off-by-one"
      },
      "answer": {
        "prompt": "Double of 28",
        "options": [
          56,
          38,
          57
        ],
        "correctIndex": 0,
        "correctValue": 56,
        "explanation": "Double of 28 is 56"
      }
    },
    {
      "set": "A",
      "id": "A_r11_double-29",
      "round": 11,
      "stage": 3,
      "type": "A",
      "n": 29,
      "prompt": "Double of 29",
      "options": [
        58,
        39,
        57
      ],
      "correctIndex": 0,
      "correctValue": 58,
      "correctTTS": "Nice — double of 29 is 58.",
      "correctSubtitle": "Double of 29 is 58.",
      "wrongTTS": "Double of 29 is 58.",
      "wrongSubtitle": "Double of 29 is 58.",
      "misconception_tags": {
        "39": "added-10-instead-of-doubled",
        "57": "off-by-one"
      },
      "answer": {
        "prompt": "Double of 29",
        "options": [
          58,
          39,
          57
        ],
        "correctIndex": 0,
        "correctValue": 58,
        "explanation": "Double of 29 is 58"
      }
    },
    {
      "set": "A",
      "id": "A_r12_double-31",
      "round": 12,
      "stage": 3,
      "type": "A",
      "n": 31,
      "prompt": "Double of 31",
      "options": [
        62,
        72,
        63
      ],
      "correctIndex": 0,
      "correctValue": 62,
      "correctTTS": "Nice — double of 31 is 62.",
      "correctSubtitle": "Double of 31 is 62.",
      "wrongTTS": "Double of 31 is 62.",
      "wrongSubtitle": "Double of 31 is 62.",
      "misconception_tags": {
        "63": "off-by-one",